[
  {
    "name": "IBM System/360 Model 50",
    "year": 1965,
    "manufacturer": "IBM",
    "cpu_name": "IBM System/360",
    "cpu_cores": 1,
    "cpu_transistors": 15000,
    "cpu_clock_mhz": 0.5,
    "cpu_process_nm": 50000,
    "ram_mb": 0.256,
    "storage_mb": 7,
    "performance_mips": 0.1,
    "performance_flops": null,
    "power_watts": 20000,
    "price_usd": 253000,
    "architecture": "System/360",
    "instruction_set": "S/360",
    "notes": "Revolutionary mainframe that established industry standards"
  },
  {
    "name": "Intel 4004 System",
    "year": 1971,
    "manufacturer": "Intel",
    "cpu_name": "Intel 4004",
    "cpu_cores": 1,
    "cpu_transistors": 2300,
    "cpu_clock_mhz": 0.74,
    "cpu_process_nm": 10000,
    "ram_mb": 0.00064,
    "storage_mb": 0.032,
    "performance_mips": 0.092,
    "performance_flops": null,
    "power_watts": 1,
    "price_usd": 200,
    "architecture": "4-bit",
    "instruction_set": "4004",
    "notes": "First commercial microprocessor"
  },
  {
    "name": "Apple II",
    "year": 1977,
    "manufacturer": "Apple",
    "cpu_name": "MOS 6502",
    "cpu_cores": 1,
    "cpu_transistors": 3510,
    "cpu_clock_mhz": 1.023,
    "cpu_process_nm": 8000,
    "ram_mb": 0.004,
    "storage_mb": 143,
    "performance_mips": 0.43,
    "performance_flops": null,
    "power_watts": 40,
    "price_usd": 1298,
    "architecture": "8-bit",
    "instruction_set": "MOS 6502",
    "notes": "Pioneering personal computer"
  },
  {
    "name": "IBM PC 5150",
    "year": 1981,
    "manufacturer": "IBM",
    "cpu_name": "Intel 8088",
    "cpu_cores": 1,
    "cpu_transistors": 29000,
    "cpu_clock_mhz": 4.77,
    "cpu_process_nm": 3000,
    "ram_mb": 0.064,
    "storage_mb": 160,
    "performance_mips": 0.33,
    "performance_flops": null,
    "power_watts": 114,
    "price_usd": 1565,
    "architecture": "x86-16",
    "instruction_set": "x86",
    "notes": "Established the IBM PC standard"
  },
  {
    "name": "Commodore 64",
    "year": 1982,
    "manufacturer": "Commodore",
    "cpu_name": "MOS 6510",
    "cpu_cores": 1,
    "cpu_transistors": 3510,
    "cpu_clock_mhz": 1.023,
    "cpu_process_nm": 7000,
    "ram_mb": 0.064,
    "storage_mb": 170,
    "performance_mips": 0.43,
    "performance_flops": null,
    "power_watts": 25,
    "price_usd": 595,
    "architecture": "8-bit",
    "instruction_set": "MOS 6510",
    "notes": "Best-selling single computer model of all time"
  },
  {
    "name": "Macintosh 128K",
    "year": 1984,
    "manufacturer": "Apple",
    "cpu_name": "Motorola 68000",
    "cpu_cores": 1,
    "cpu_transistors": 68000,
    "cpu_clock_mhz": 7.83,
    "cpu_process_nm": 3500,
    "ram_mb": 0.128,
    "storage_mb": 400,
    "performance_mips": 1.35,
    "performance_flops": null,
    "power_watts": 60,
    "price_usd": 2495,
    "architecture": "32-bit",
    "instruction_set": "68k",
    "notes": "First successful mass-market personal computer with GUI"
  },
  {
    "name": "Intel 386 PC",
    "year": 1986,
    "manufacturer": "Intel",
    "cpu_name": "Intel 80386",
    "cpu_cores": 1,
    "cpu_transistors": 275000,
    "cpu_clock_mhz": 16,
    "cpu_process_nm": 1500,
    "ram_mb": 1,
    "storage_mb": 40000,
    "performance_mips": 5,
    "performance_flops": null,
    "power_watts": 120,
    "price_usd": 3995,
    "architecture": "x86-32",
    "instruction_set": "x86",
    "notes": "First 32-bit x86 processor"
  },
  {
    "name": "Intel 486 DX2/66",
    "year": 1992,
    "manufacturer": "Intel",
    "cpu_name": "Intel 486 DX2",
    "cpu_cores": 1,
    "cpu_transistors": 1200000,
    "cpu_clock_mhz": 66,
    "cpu_process_nm": 800,
    "ram_mb": 8,
    "storage_mb": 200000,
    "performance_mips": 54,
    "performance_flops": 27000000,
    "power_watts": 150,
    "price_usd": 2000,
    "architecture": "x86-32",
    "instruction_set": "x86",
    "notes": "Popular processor for early Windows systems"
  },
  {
    "name": "Pentium 100 PC",
    "year": 1994,
    "manufacturer": "Intel",
    "cpu_name": "Intel Pentium",
    "cpu_cores": 1,
    "cpu_transistors": 3100000,
    "cpu_clock_mhz": 100,
    "cpu_process_nm": 600,
    "ram_mb": 16,
    "storage_mb": 500000,
    "performance_mips": 188,
    "performance_flops": 100000000,
    "power_watts": 180,
    "price_usd": 2500,
    "architecture": "x86-32",
    "instruction_set": "x86",
    "notes": "Mainstream processor for mid-90s computing"
  },
  {
    "name": "Pentium II 300 PC",
    "year": 1997,
    "manufacturer": "Intel",
    "cpu_name": "Intel Pentium II",
    "cpu_cores": 1,
    "cpu_transistors": 7500000,
    "cpu_clock_mhz": 300,
    "cpu_process_nm": 350,
    "ram_mb": 64,
    "storage_mb": 4000000,
    "performance_mips": 466,
    "performance_flops": 300000000,
    "power_watts": 200,
    "price_usd": 2000,
    "architecture": "x86-32",
    "instruction_set": "x86",
    "notes": "Popular during the Internet boom"
  },
  {
    "name": "Pentium III 1GHz PC",
    "year": 2000,
    "manufacturer": "Intel",
    "cpu_name": "Intel Pentium III",
    "cpu_cores": 1,
    "cpu_transistors": 28100000,
    "cpu_clock_mhz": 1000,
    "cpu_process_nm": 180,
    "ram_mb": 256,
    "storage_mb": 20000000,
    "performance_mips": 2054,
    "performance_flops": 2000000000,
    "power_watts": 250,
    "price_usd": 1500,
    "architecture": "x86-32",
    "instruction_set": "x86",
    "notes": "First 1GHz mainstream processor"
  },
  {
    "name": "Pentium 4 3GHz PC",
    "year": 2003,
    "manufacturer": "Intel",
    "cpu_name": "Intel Pentium 4",
    "cpu_cores": 1,
    "cpu_transistors": 55000000,
    "cpu_clock_mhz": 3000,
    "cpu_process_nm": 90,
    "ram_mb": 512,
    "storage_mb": 80000000,
    "performance_mips": 9726,
    "performance_flops": 6000000000,
    "power_watts": 300,
    "price_usd": 1200,
    "architecture": "x86-32",
    "instruction_set": "x86",
    "notes": "High-frequency NetBurst architecture"
  },
  {
    "name": "Core 2 Duo E6600 PC",
    "year": 2006,
    "manufacturer": "Intel",
    "cpu_name": "Intel Core 2 Duo E6600",
    "cpu_cores": 2,
    "cpu_transistors": 291000000,
    "cpu_clock_mhz": 2400,
    "cpu_process_nm": 65,
    "ram_mb": 2048,
    "storage_mb": 250000000,
    "performance_mips": 27079,
    "performance_flops": 19200000000,
    "power_watts": 200,
    "price_usd": 1000,
    "architecture": "x86-64",
    "instruction_set": "x86-64",
    "notes": "Return to efficiency-focused design"
  },
  {
    "name": "Core i7-920 PC",
    "year": 2008,
    "manufacturer": "Intel",
    "cpu_name": "Intel Core i7-920",
    "cpu_cores": 4,
    "cpu_transistors": 731000000,
    "cpu_clock_mhz": 2660,
    "cpu_process_nm": 45,
    "ram_mb": 6144,
    "storage_mb": 500000000,
    "performance_mips": 82300,
    "performance_flops": 85000000000,
    "power_watts": 230,
    "price_usd": 1200,
    "architecture": "x86-64",
    "instruction_set": "x86-64",
    "notes": "First Core i7 Nehalem architecture"
  },
  {
    "name": "Core i5-2500K PC",
    "year": 2011,
    "manufacturer": "Intel",
    "cpu_name": "Intel Core i5-2500K",
    "cpu_cores": 4,
    "cpu_transistors": 995000000,
    "cpu_clock_mhz": 3300,
    "cpu_process_nm": 32,
    "ram_mb": 8192,
    "storage_mb": 1000000000,
    "performance_mips": 128000,
    "performance_flops": 105600000000,
    "power_watts": 180,
    "price_usd": 900,
    "architecture": "x86-64",
    "instruction_set": "x86-64",
    "notes": "Sandy Bridge - huge IPC improvement"
  },
  {
    "name": "Core i7-4770K PC",
    "year": 2013,
    "manufacturer": "Intel",
    "cpu_name": "Intel Core i7-4770K",
    "cpu_cores": 4,
    "cpu_transistors": 1400000000,
    "cpu_clock_mhz": 3500,
    "cpu_process_nm": 22,
    "ram_mb": 16384,
    "storage_mb": 2000000000,
    "performance_mips": 147000,
    "performance_flops": 112000000000,
    "power_watts": 160,
    "price_usd": 1000,
    "architecture": "x86-64",
    "instruction_set": "x86-64",
    "notes": "Haswell architecture with improved efficiency"
  },
  {
    "name": "Core i7-6700K PC",
    "year": 2015,
    "manufacturer": "Intel",
    "cpu_name": "Intel Core i7-6700K",
    "cpu_cores": 4,
    "cpu_transistors": 1750000000,
    "cpu_clock_mhz": 4000,
    "cpu_process_nm": 14,
    "ram_mb": 32768,
    "storage_mb": 4000000000,
    "performance_mips": 185000,
    "performance_flops": 128000000000,
    "power_watts": 150,
    "architecture": "x86-64",
    "instruction_set": "x86-64",
    "notes": "Skylake - first mainstream 14nm desktop processor"
  },
  {
    "name": "Ryzen 7 1800X PC",
    "year": 2017,
    "manufacturer": "AMD",
    "cpu_name": "AMD Ryzen 7 1800X",
    "cpu_cores": 8,
    "cpu_transistors": 4800000000,
    "cpu_clock_mhz": 3600,
    "cpu_process_nm": 14,
    "ram_mb": 32768,
    "storage_mb": 8000000000,
    "performance_mips": 304000,
    "performance_flops": 461000000000,
    "power_watts": 180,
    "price_usd": 1200,
    "architecture": "x86-64",
    "instruction_set": "x86-64",
    "notes": "AMD's return to high-end desktop market"
  },
  {
    "name": "Core i9-9900K PC",
    "year": 2018,
    "manufacturer": "Intel",
    "cpu_name": "Intel Core i9-9900K",
    "cpu_cores": 8,
    "cpu_transistors": 1700000000,
    "cpu_clock_mhz": 3600,
    "cpu_process_nm": 14,
    "ram_mb": 65536,
    "storage_mb": 16000000000,
    "performance_mips": 332000,
    "performance_flops": 461000000000,
    "power_watts": 200,
    "price_usd": 1500,
    "architecture": "x86-64",
    "instruction_set": "x86-64",
    "notes": "8-core mainstream flagship"
  },
  {
    "name": "Ryzen 9 3950X PC",
    "year": 2019,
    "manufacturer": "AMD",
    "cpu_name": "AMD Ryzen 9 3950X",
    "cpu_cores": 16,
    "cpu_transistors": 3800000000,
    "cpu_clock_mhz": 3500,
    "cpu_process_nm": 7,
    "ram_mb": 65536,
    "storage_mb": 32000000000,
    "performance_mips": 612000,
    "performance_flops": 896000000000,
    "power_watts": 190,
    "price_usd": 1800,
    "architecture": "x86-64",
    "instruction_set": "x86-64",